{
  "schemaVersion": "1.0.0",
  "taskId": "SUT-AIOS-GOV-048",
  "status": "pass",
  "reviewer": "qa-verification",
  "verifierModel": "gpt-5.6-sol",
  "implementerAgent": "engineering-planner",
  "reviewedAt": "2026-07-29T17:12:58.747Z",
  "checks": [
    "changed-path-inspection: pass",
    "security-boundaries: pass"
  ],
  "tests": [
    "node scripts/verify/verify-cli.mjs --self-test: pass",
    "node scripts/task/validate --all: pass",
    "node scripts/github/validate-governance.mjs: pass",
    "npm run verify:fast: pass",
    "git diff --check: pass"
  ],
  "acceptanceCriteria": [
    "confirmed: Only the exact literal `node tests/infrastructure-contracts/validate-infrastructure-port-contract-v1.mjs` is newly admitted and maps to `node` with exactly one fixed repository-relative path argument through the existing `shell: false` runner.",
    "confirmed: Self-tests accept the exact literal and reject leading, doubled, and trailing whitespace; extra arguments; chaining and shell operators; redirects; command substitution; alternate and sibling paths; dot-path and traversal forms; absolute paths; and Windows path separators.",
    "confirmed: No generic Node or test-path pattern, arbitrary argument parsing, shell execution, mutation-capable command, product validator/schema/policy/module, SDK, adapter, authentication, network, storage, queue, workflow, deployment, external call, or production behavior is introduced.",
    "confirmed: Verification policy and a durable risk entry identify the exact admission, its non-product scope, and the remaining P2-005 implementation and independent-verification boundary.",
    "confirmed: Packet-authorized deterministic checks pass and implementation evidence is ready for separate independent Sol QA; the implementer does not run `verify:task` or act as completion authority."
  ],
  "changedPaths": [
    "docs/project/ISSUES_AND_RISKS.md",
    "docs/verification/VERIFICATION_POLICY.md",
    "evidence/tasks/SUT-AIOS-GOV-048/verification.md",
    "scripts/verify/verify-cli.mjs",
    "tasks/backlog/SUT-AIOS-GOV-048/task.json",
    "tasks/review/SUT-AIOS-GOV-048/task.json"
  ],
  "forbiddenPathsUntouched": true,
  "productionEligible": false,
  "evidenceReferences": [
    "evidence/verification/SUT-AIOS-GOV-048/verification-20260729171258747.json"
  ],
  "risks": [],
  "recommendation": "verified"
}
