{
  "schemaVersion": "1.0.0",
  "taskId": "SUT-AIOS-GOV-026",
  "status": "pass",
  "reviewer": "qa-verification",
  "verifierModel": "gpt-5.6-sol",
  "implementerAgent": "codex-engineering-executor",
  "reviewedAt": "2026-07-27T16:30:53.124Z",
  "checks": [
    "changed-path-inspection: pass",
    "security-boundaries: pass"
  ],
  "tests": [
    "node scripts/verify/verify-cli.mjs --self-test: pass",
    "npm run verify:fast: pass"
  ],
  "acceptanceCriteria": [
    "confirmed: scripts/verify/verify-cli.mjs maps node tests/policy-engine/validate-deterministic-policy-evaluator.mjs byte-for-byte to node with single fixed argument and shell: false.",
    "confirmed: scripts/verify/verify-cli.mjs selfTest() verifies rejection of invalid command variants.",
    "confirmed: docs/verification/VERIFICATION_POLICY.md documents admission of the P1-005 policy-engine validator command.",
    "confirmed: verify-cli self-test, verify:fast, and task verification pass."
  ],
  "changedPaths": [
    "docs/verification/VERIFICATION_POLICY.md",
    "scripts/verify/verify-cli.mjs",
    "tasks/active/SUT-AIOS-GOV-026/task.json"
  ],
  "forbiddenPathsUntouched": true,
  "productionEligible": false,
  "evidenceReferences": [
    "evidence/verification/SUT-AIOS-GOV-026/verification-20260727163053124.json"
  ],
  "risks": [],
  "recommendation": "verified"
}
