{
  "schemaVersion": "1.0.0",
  "taskId": "SUT-AIOS-GOV-042",
  "status": "pass",
  "reviewer": "qa-verification",
  "verifierModel": "gpt-5.6-sol",
  "implementerAgent": "engineering-planner",
  "reviewedAt": "2026-07-29T11:40:46.326Z",
  "checks": [
    "changed-path-inspection: pass",
    "security-boundaries: pass"
  ],
  "tests": [
    "node tests/ai-analysis/validate-intelligence-provider-contracts-v1.mjs: pass",
    "node scripts/github/validate-governance.mjs: pass",
    "node scripts/task/validate --all: pass",
    "npm run verify:fast: pass",
    "git diff --check: pass"
  ],
  "acceptanceCriteria": [
    "confirmed: The Governance / validate workflow contains one explicit step named for P2-002 that runs exactly node tests/ai-analysis/validate-intelligence-provider-contracts-v1.mjs.",
    "confirmed: The P2-002 step executes after dependency installation, repository governance checks, task validation, and npm run verify:fast, and does not replace or weaken any existing CI step.",
    "confirmed: No wildcard, matrix, shell composition, generic node tests pattern, arbitrary argument forwarding, or mutation-capable command is introduced.",
    "confirmed: No P2-002 product, schema, package, dependency, provider, gateway, proposal, workflow, executor, live-data, or production path is changed.",
    "confirmed: The exact P2-002 validator, all task-packet validation, repository fast verification, governance validation, and diff whitespace checks pass locally before independent Sol QA.",
    "confirmed: Implementation evidence records the bounded changed paths, commands, results, limitations, and rollback; the implementer does not run verify:task or act as completion authority."
  ],
  "changedPaths": [
    ".github/workflows/validate-governance.yml",
    "docs/project/ISSUES_AND_RISKS.md",
    "docs/verification/VERIFICATION_POLICY.md",
    "evidence/tasks/SUT-AIOS-GOV-042/verification.md",
    "tasks/review/SUT-AIOS-GOV-042/task.json"
  ],
  "forbiddenPathsUntouched": true,
  "productionEligible": false,
  "evidenceReferences": [
    "evidence/verification/SUT-AIOS-GOV-042/verification-20260729114046326.json"
  ],
  "risks": [],
  "recommendation": "verified"
}
