{
  "schemaVersion": "1.0.0",
  "taskId": "SUT-AIOS-P0-001",
  "status": "pass",
  "reviewer": "engineering-planner",
  "verifierModel": "gpt-5.6-terra",
  "implementerAgent": "qa-verification",
  "reviewedAt": "2026-07-26T13:26:32.601Z",
  "checks": [
    "changed-path-inspection: pass",
    "security-boundaries: pass"
  ],
  "tests": [
    "node scripts/verify/full: pass",
    "npm run verify:fast: pass"
  ],
  "acceptanceCriteria": [
    "confirmed: Establish clean technical baseline gate is implemented only within the declared subsystem.",
    "confirmed: Machine-readable contracts and deterministic failure behavior are documented.",
    "confirmed: Required tests pass and independent verification confirms forbidden paths were untouched."
  ],
  "changedPaths": [
    "docs/verification/TECHNICAL_BASELINE_GATE.md",
    "docs/verification/technical-baseline-gate.json",
    "evidence/tasks/SUT-AIOS-P0-001/verification.md",
    "evidence/verification/SUT-AIOS-P0-001/verification-20260726132407152.json",
    "evidence/verification/SUT-AIOS-P0-001/verification-20260726132515005.json",
    "evidence/verification/SUT-AIOS-P0-001/verification-20260726132532912.json",
    "evidence/verification/SUT-AIOS-P0-001/verification-20260726132605916.json",
    "tasks/ready/SUT-AIOS-P0-001/task.json",
    "tasks/review/SUT-AIOS-P0-001/context/artifact-index.md",
    "tasks/review/SUT-AIOS-P0-001/context/decisions.md",
    "tasks/review/SUT-AIOS-P0-001/context/file-map.md",
    "tasks/review/SUT-AIOS-P0-001/context/known-risks.md",
    "tasks/review/SUT-AIOS-P0-001/context/latest-handoff.md",
    "tasks/review/SUT-AIOS-P0-001/context/task-context.md",
    "tasks/review/SUT-AIOS-P0-001/task.json"
  ],
  "forbiddenPathsUntouched": true,
  "productionEligible": false,
  "evidenceReferences": [
    "evidence/verification/SUT-AIOS-P0-001/verification-20260726132632601.json"
  ],
  "risks": [],
  "recommendation": "verified"
}
