{
  "schemaVersion": "1.0.0",
  "taskId": "SUT-AIOS-GOV-023",
  "status": "pass",
  "reviewer": "qa-verification",
  "verifierModel": "gpt-5.6-sol",
  "implementerAgent": "codex-engineering-executor",
  "reviewedAt": "2026-07-27T15:58:56.029Z",
  "checks": [
    "changed-path-inspection: pass",
    "security-boundaries: pass"
  ],
  "tests": [
    "node tests/policy-definitions/validate-authorization-policies.mjs: pass",
    "npm run verify:fast: pass"
  ],
  "acceptanceCriteria": [
    "confirmed: schemas/authorization-policy-contract.schema.json provides formal JSON schema validation for authorization policy contracts.",
    "confirmed: docs/policy-definitions/DETERMINISTIC_AUTHORIZATION_POLICIES.md explicitly clarifies static taxonomy title and non-discretionary safety boundaries for platform_read_only.",
    "confirmed: tests/policy-definitions/validate-authorization-policies.mjs executes 108+ exhaustive negative/mutation tests.",
    "confirmed: Task validation, fast governance verification, changed-path inspection, secret scan, and independent machine verification pass with green CI."
  ],
  "changedPaths": [
    "docs/policy-definitions/DETERMINISTIC_AUTHORIZATION_POLICIES.md",
    "docs/project/ISSUES_AND_RISKS.md",
    "schemas/authorization-policy-contract.schema.json",
    "tasks/active/SUT-AIOS-GOV-023/task.json",
    "tests/policy-definitions/validate-authorization-policies.mjs"
  ],
  "forbiddenPathsUntouched": true,
  "productionEligible": false,
  "evidenceReferences": [
    "evidence/verification/SUT-AIOS-GOV-023/verification-20260727155856029.json"
  ],
  "risks": [],
  "recommendation": "verified"
}
