{
  "schemaVersion": "1.0.0",
  "taskId": "SUT-AIOS-P0-002",
  "status": "pass",
  "reviewer": "qa-verification",
  "verifierModel": "gpt-5.6-sol",
  "implementerAgent": "codex-engineering-executor",
  "reviewedAt": "2026-07-26T16:13:46.223Z",
  "checks": [
    "changed-path-inspection: pass",
    "security-boundaries: pass"
  ],
  "tests": [
    "npm audit --omit=dev: pass",
    "npm run verify:fast: pass"
  ],
  "acceptanceCriteria": [
    "confirmed: Plan dependency and security remediation is implemented only within the declared subsystem.",
    "confirmed: Machine-readable contracts and deterministic failure behavior are documented.",
    "confirmed: Required tests pass and independent verification confirms forbidden paths were untouched."
  ],
  "changedPaths": [
    "tasks/blocked/SUT-AIOS-P0-002/task.json",
    "tasks/review/SUT-AIOS-P0-002/task.json"
  ],
  "forbiddenPathsUntouched": true,
  "productionEligible": false,
  "evidenceReferences": [
    "evidence/verification/SUT-AIOS-P0-002/verification-20260726161346223.json"
  ],
  "risks": [],
  "recommendation": "verified"
}
