{
  "schemaVersion": "1.0.0",
  "taskId": "SUT-AIOS-GOV-038",
  "status": "pass",
  "reviewer": "qa-verification",
  "verifierModel": "gpt-5.6-sol",
  "implementerAgent": "engineering-planner",
  "reviewedAt": "2026-07-28T14:50:20.191Z",
  "checks": [
    "changed-path-inspection: pass",
    "security-boundaries: pass"
  ],
  "tests": [
    "node scripts/task/validate --all: pass",
    "npm run verify:fast: pass",
    "git diff --check: pass"
  ],
  "acceptanceCriteria": [
    "confirmed: A durable design specifies exactly two closed V1 schemas, one pure calculator module, and one deterministic Node validator with fail-closed malformed-input behavior.",
    "confirmed: The design fixes a finite metric-comparison request and result including current/baseline values, movement, sample sizes, bounded confidence, and non-inferential context.",
    "confirmed: The P2-001 packet is amended only to the designed static scope and names its exact future Node validator command.",
    "confirmed: The design requires separately approved exact shell-free verifier admission with near-miss rejection coverage.",
    "confirmed: Independent QA can confirm no product implementation, schema, test, verifier, CI, runtime, protected path, or historical evidence was altered."
  ],
  "changedPaths": [
    "docs/analytics/P2-001_DETERMINISTIC_ANALYTICS_CALCULATORS_V1_DESIGN.md",
    "docs/project/ISSUES_AND_RISKS.md",
    "evidence/tasks/SUT-AIOS-GOV-038/verification.md",
    "tasks/backlog/SUT-AIOS-P2-001/task.json",
    "tasks/review/SUT-AIOS-GOV-038/task.json"
  ],
  "forbiddenPathsUntouched": true,
  "productionEligible": false,
  "evidenceReferences": [
    "evidence/verification/SUT-AIOS-GOV-038/verification-20260728145020191.json"
  ],
  "risks": [],
  "recommendation": "verified"
}
