{
  "schemaVersion": "1.0.0",
  "taskId": "SUT-AIOS-GOV-059",
  "status": "pass",
  "reviewer": "qa-verification",
  "verifierModel": "gpt-5.6-sol",
  "implementerAgent": "codex-engineering-executor",
  "reviewedAt": "2026-08-13T07:37:22.724Z",
  "checks": [
    "changed-path-inspection: pass",
    "security-boundaries: pass"
  ],
  "tests": [
    "node scripts/verify/verify-cli.mjs --self-test: pass",
    "node scripts/task/validate --all: pass",
    "node scripts/github/validate-governance.mjs: pass",
    "npm run verify:fast: pass",
    "git diff --check: pass"
  ],
  "acceptanceCriteria": [
    "confirmed: safeRequiredCommand maps exactly npm run test:signal-ingestion to node tests/signal-ingestion/validate-signal-ingestion-v1.mjs with shell-free fixed arguments.",
    "confirmed: The verifier self-test proves the exact mapping and rejects trailing whitespace, extra arguments, shell operators, altered paths, alternate npm syntax, and path-separator near misses.",
    "confirmed: The verification policy documents that this is a single P3-001 validator admission and does not enable generic npm, node, shell, or package execution.",
    "confirmed: No P3-001 implementation, tests, package-lock, CI workflow, Workflow V2 machinery, production behavior, credentials, or external service is changed.",
    "confirmed: The governance task passes deterministic verifier self-test, packet validation, governance validation, fast verification, whitespace checks, and independent verify:task evidence."
  ],
  "changedPaths": [
    "docs/project/ISSUES_AND_RISKS.md",
    "docs/verification/VERIFICATION_POLICY.md",
    "evidence/tasks/SUT-AIOS-GOV-059/verification.md",
    "scripts/verify/verify-cli.mjs",
    "tasks/active/SUT-AIOS-GOV-059/task.json"
  ],
  "forbiddenPathsUntouched": true,
  "productionEligible": false,
  "evidenceReferences": [
    "evidence/verification/SUT-AIOS-GOV-059/verification-20260813073722724.json"
  ],
  "risks": [],
  "recommendation": "verified"
}
